flow_id,flow,input,output,artifacts,status,risk,evidence
FLOW_01,Preparar paquete sin modelo,selected context/setup,package + fixture review/diagnostic-ready state,"package_manifest, prompt_context, chart when applicable",passed,user may confuse fixture with AI review,default action remains package preparation
FLOW_02,Analizar con Codex local sin macro,prepared package + explicit Codex button,review_output.json + report PDF if schema passes,anexo_ai_analyst_curado,passed,latency or schema failure produces diagnostic PDF,UTF-8 smoke generated valid report
FLOW_03,Analizar con Codex + macro,prepared package + explicit macro button,technical review plus macro_context_summary and macro_sources,anexo_ai_analyst_curado,passed,macro search can be incomplete or unknown,macro run recorded model_called=true and output_validation_status=pass
FLOW_04,Descargar informe PDF validado,gateway pass output,ai_analyst_review_report.pdf,report pdf + tex when available,passed,PDF must remain readable with long URLs,"external links rendered as clickable labels, local sources described"
FLOW_05,Descargar diagnostico PDF,blocked/invalid gateway output,diagnostic PDF,anexo_ai_analyst_curado,passed,must be visually distinct from analytical report,Dash labels diagnostic separately
FLOW_06,Paquete WeaveCount con grafico,selected weavecount case,structural package and chart,weavecount_case package in Dash integration path,passed,must not look like Elliott signal,PDF adds Elliott paragraph as study-only hypothesis
FLOW_07,Paquete Mercado,market_summary context,market_context package/report,Dash market_summary package path,passed,market context may be stale if refresh not validated live,base market included as context
FLOW_08,Paquete Correlacion,selected correlation pair/context,correlation package/report,Dash correlation package path,passed,correlation can be misread as causal relation,context-only language policy
