candidate_order,candidate_id,filename,scenario,symbol,timeframe,swing_degree,direction,issue_type,manual_assessment,recommended_action,user_observation,diagnostic_status,wave5_endpoint_status,proposed_endpoint_classification,future_more_extreme_found,post_wave5_extreme_time,post_wave5_extension_vs_wave5,post_wave5_extension_vs_wave1,causal_note,chart_path_absolute,latest_user_interpretation,visual_validity_after_review,endpoint_interpretation,higher_degree_substructure_possible,possible_higher_degree_read,should_not_downgrade_visual_quality,final_methodological_label
1,impulse_forex_audjpy_h1_minor_impulse_013,001_impulse_forex_audjpy_h1_minor_impulse_013.png,h1_m30,AUDJPY.r,H1,minor,bullish,premature_wave5_completion,downgrade,keep_as_local_example_with_higher_degree_note,La onda 5 termina un poco mas adelante.,strict_candidate_impulse,premature_wave5_completion,premature_wave5_completion,True,2026-03-11 18:00:00,0.1399914639351269,0.3886255924170678,"A later confirmed structural pivot makes a materially more extreme wave-5 endpoint. This is a post-count diagnostic, so live code should treat the original impulse as provisional until confirmation.",C:\Users\ralr1\Desktop\CD\TFG\TFG-Raul_Rodriguez\artifacts\wavecount\phase2_3_visual_review_2026-05-17\h1_m30\charts\impulses\001_impulse_forex_audjpy_h1_minor_impulse_013.png,"Se ve bien como conteo local. La onda 5 podria terminar algo mas arriba, y las cinco ondas podrian ser una onda 1 mayor o parte de una 1-2-3 mayor.",valid_local_count,endpoint_uncertain_not_bad_count,True,possible_wave_1_or_part_of_wave_3,True,candidate_impulse_provisional_with_endpoint_uncertainty
3,impulse_index_aus200_h1_minor_impulse_006,003_impulse_index_aus200_h1_minor_impulse_006.png,h1_m30,AUS200,H1,minor,bearish,premature_wave5_completion,downgrade,keep_as_ambiguous_higher_degree_example,La onda 5 termina pronto.,strict_candidate_impulse,premature_wave5_completion,premature_wave5_completion,True,2026-03-09 04:00:00,1.272922944468367,3.3412429378531154,"A later confirmed structural pivot makes a materially more extreme wave-5 endpoint. This is a post-count diagnostic, so live code should treat the original impulse as provisional until confirmation.",C:\Users\ralr1\Desktop\CD\TFG\TFG-Raul_Rodriguez\artifacts\wavecount\phase2_3_visual_review_2026-05-17\h1_m30\charts\impulses\003_impulse_index_aus200_h1_minor_impulse_006.png,Podria estar bien como minor. Visualmente tambien encaja como onda 1-2 y arranque de una tercera mayor; no debe tratarse como conteo malo automaticamente.,valid_local_or_higher_degree_setup,endpoint_uncertain_not_bad_count,True,possible_wave_1_2_then_wave_3_start,True,possible_higher_degree_subwave
5,impulse_forex_audjpy_h1_intermediate_impulse_009,005_impulse_forex_audjpy_h1_intermediate_impulse_009.png,h1_m30,AUDJPY.r,H1,intermediate,bullish,good_reference,keep,keep_as_good_example,Esta muy bien y corrige el problema del anterior.,strict_candidate_impulse,clean_or_unresolved_wave5_endpoint,candidate_impulse_provisional,False,,,,"No material later same-direction structural extreme was found inside the diagnostic horizon. The clean impulse remains provisional, not a trading signal.",C:\Users\ralr1\Desktop\CD\TFG\TFG-Raul_Rodriguez\artifacts\wavecount\phase2_3_visual_review_2026-05-17\h1_m30\charts\impulses\005_impulse_forex_audjpy_h1_intermediate_impulse_009.png,Esta bien y debe mantenerse como buen ejemplo.,good_example,clean_or_unresolved_endpoint,False,,True,candidate_impulse_provisional_good_example
8,impulse_forex_eurjpy_m30_intermediate_impulse_005,008_impulse_forex_eurjpy_m30_intermediate_impulse_005.png,h1_m30,EURJPY.r,M30,intermediate,bearish,premature_wave5_completion,downgrade,keep_as_valid_but_provisional,La onda 5 deberia terminar en la bajada siguiente.,strict_candidate_impulse,premature_wave5_completion,premature_wave5_completion,True,2026-03-16 10:30:00,0.3439897698209866,0.2969094922737441,"A later confirmed structural pivot makes a materially more extreme wave-5 endpoint. This is a post-count diagnostic, so live code should treat the original impulse as provisional until confirmation.",C:\Users\ralr1\Desktop\CD\TFG\TFG-Raul_Rodriguez\artifacts\wavecount\phase2_3_visual_review_2026-05-17\h1_m30\charts\impulses\008_impulse_forex_eurjpy_m30_intermediate_impulse_005.png,Se ve bien. Puede considerarse que la onda 5 termina ahi o que recoge toda la bajada; no debe penalizarse agresivamente.,valid_local_count,endpoint_uncertain_not_bad_count,True,possible_extended_wave_5_or_larger_leg,True,candidate_impulse_provisional_with_endpoint_uncertainty
37,near_miss_forex_audjpy_h1_intermediate_impulse_011,037_near_miss_forex_audjpy_h1_intermediate_impulse_011.png,h1_m30,AUDJPY.r,H1,intermediate,bullish,truncated_fifth_candidate,keep_with_caution,keep_as_near_miss_with_limitation,Mas o menos bien; revisar regla de onda 5 que no excede onda 3.,soft_impulse_near_miss,truncated_fifth_candidate,truncated_fifth_candidate,False,,,,"Wave 5 does not exceed wave 3. Keep as truncation/near-miss, not as a clean impulse.",C:\Users\ralr1\Desktop\CD\TFG\TFG-Raul_Rodriguez\artifacts\wavecount\phase2_3_visual_review_2026-05-17\h1_m30\charts\impulses\037_near_miss_forex_audjpy_h1_intermediate_impulse_011.png,Visualmente gusta. Puede no exceder onda 3 porque el grafico se corta; no debe etiquetarse como truncamiento definitivo sin esa limitacion.,visually_good_near_miss,truncation_uncertain_due_to_window_cut,True,possible_continuation_outside_window,True,near_miss_with_window_cut_uncertainty
39,near_miss_index_aus200_h1_intermediate_impulse_008,039_near_miss_index_aus200_h1_intermediate_impulse_008.png,h1_m30,AUS200,H1,intermediate,bearish,acceptable_near_miss,keep,keep_as_near_miss_example,El usuario lo ve bien.,soft_impulse_near_miss,truncated_fifth_candidate,truncated_fifth_candidate,False,,,,"Wave 5 does not exceed wave 3. Keep as truncation/near-miss, not as a clean impulse.",C:\Users\ralr1\Desktop\CD\TFG\TFG-Raul_Rodriguez\artifacts\wavecount\phase2_3_visual_review_2026-05-17\h1_m30\charts\impulses\039_near_miss_index_aus200_h1_intermediate_impulse_008.png,Esta bien / aceptable como near-miss.,acceptable_near_miss,near_miss_not_clean_impulse,False,,True,acceptable_near_miss
