decision,selected,justification,what_is_gained,what_is_avoided,what_remains_pending,memory_impact,roadmap_impact
no_go_keep_preview_only,true,"The current artifact/preflight/preview chain already provides reproducible traceability and safety evidence. A real writer now adds DB/credential/DDL risk without being required by dashboard, Telegram, bot dry-run or AI Analyst.","Keeps SQL runtime evidence useful for review and memory while preserving fail-closed posture.","Avoids SQL writes, DB connection, DDL/migration, credential handling and premature MT5-like runtime semantics.","Real writer, real runtime tables, DB target policy, DDL migration and retention policy remain future work.","Memory can present SQL runtime as designed and preview-validated, not as active SQL persistence.","Close SQL runtime implementation at preview/review and move to another pending read-only phase."
go_writer_real_design_next,false,"A design already exists and has enough detail; more design would not reduce the main risk unless DB policy/DDL scope is approved.","Could refine DB policy further.","Still risks drifting toward implementation.","Would need explicit DB/DDL policy decision first.","Would remain future-facing.","Not recommended now."
go_writer_real_implementation_preview_to_local_db,false,"Could test real DB insert path locally.","Introduces connector/DDL/state before platform needs it.","DB side effects and credential handling enter scope.","Test DB and DDL review needed.","Could confuse memory framing.","Not recommended now."
defer_sql_runtime_to_future_work,false,"Safe and simple, but loses the useful preview artifact as a current technical output.","Avoids all runtime DB risk.","May underuse work already completed.","Future writer remains pending.","Could frame only as future work.","Acceptable but less precise than no_go_keep_preview_only."
blocked_by_db_policy,false,"There is no hard blocker because no real writer is being attempted.","Acknowledges DB policy risk.","Would overstate the situation as blocked rather than deliberately deferred.","DB policy pending for future.","Could be too negative for memory.","Not selected."
blocked_by_scope,false,"Scope is controlled; the issue is value/risk timing, not impossible scope.","Keeps nuance.","Would imply current work is invalid.","None.","Not appropriate.","Not selected."
