component,ready_status,phase254_policy,can_be_soft_rule,context_only,experimental,excluded,evidence_summary,risk_if_used_wrong,phase254_action,policy_reason,must_remain_non_operational
H4/D1 intermediate profile,ready_for_soft_rule,primary_soft_profile,True,False,False,False,"3 yes, 9 near-misses in controlled H4/D1 expansion.",Could be misread as trading signal instead of structural quality filter.,formalize as primary descriptive profile with no execution output,H4/D1 remains primary; no trading output,True
H1/H4 auxiliary profile,auxiliary_only,auxiliary_zoom_profile,False,True,False,False,4 yes_aux and 8 near_miss_aux; useful as zoom/substructure.,Could displace H4/D1 and reintroduce micro counts.,keep as auxiliary zoom and comparison layer,H1/H4 remains auxiliary/substructure,True
prominence/size penalty,ready_for_soft_rule,soft_penalty,True,False,False,False,20 prominence/scale problem cases detected.,A hard threshold could reject valid compact impulses.,"add soft penalty, especially for too_small_for_timeframe and short duration",penalize low prominence without hard invalidation,True
EWO role support,ready_as_context_only,context_only,False,True,False,False,149 rows show EWO support-like labels across reviewed sources.,Absolute thresholds or autonomous labels would overfit momentum noise.,keep relative wave-role context; leave EWO+SVM as future experimental work,relative momentum / wave-role context,True
EMA/HTF context,ready_as_context_only,context_only,False,True,False,False,99 rows show support/explanation context labels.,HTF lag could invalidate good transitions or rescue bad counts.,"use as soft regime/ambiguity filter, not hard validation","regime, transition and ambiguity context",True
ABC contextual,experimental,experimental_context,False,False,True,False,ABC requires parent context; isolated ABC remains unsafe.,Impulses can be mislabeled as corrections.,keep out of impulse profile; use only contextual corrections with parent,only with parent/context; isolated ABC excluded,True
partial 1-2-3,ready_as_context_only,provisional_context,False,True,False,False,Partials remain provisional and require post-3 quality checks.,Three alternating swings can be noise or a prior 4-5.,"allow only provisional context, not profile seeds",never a signal; always provisional,True
major context,ready_as_context_only,higher_degree_context,False,True,False,False,Major can be higher-degree operable context but is not the base profile.,Too coarse for candidate search if treated as primary everywhere.,use to frame H4/D1 intermediate structures,context or higher-degree structure,True
minor substructure,auxiliary_only,substructure_only,False,True,False,False,"Minor repeatedly appears as useful substructure/near-miss, not primary base.",Can create micro-Elliott counts inside lateral movement.,keep as substructure or negative/near-miss evidence,not primary; avoid microcounting,True
