study_question,purpose,dataset_needed,minimum_columns,descriptive_metrics,allowed_tests,do_not_optimize,condition_to_become_filter_candidate,condition_to_remain_visual_only
wave3_context,Do ENBOLSA trades perform better when WaveCount suggests possible wave3?,trade_log + historical WaveCount context at/near signal time,"symbol,timeframe,entry_time,return,pf_proxy,wavecount_wave_role,bucket","Return distribution, PF, win rate, trade count, effect size",bootstrap/permutation/Mann-Whitney as support,No threshold optimization by profit,Only if stable across groups and enough sample,Keep visual/context only if unstable.
wave5_warning,Do wave5/divergence contexts reduce quality?,trade_log + EWO/WaveCount diagnostics,"wave role, EWO warning, outcome",Outcome by warning class,descriptive + permutation,No automatic short/exit rule,Candidate penalty only after robust evidence,Keep as warning only.
bucket_quality,Do high_quality/usable buckets outperform low-prominence/excluded contexts?,trade_log + phase256 buckets,"phase256_policy_bucket, market_group, return","Median return, PF, drawdown proxy, sample size",bootstrap CIs,No cherry-picking bucket thresholds,Candidate filter only if consistent and causal,Remain dashboard badge.
market_group,Does WaveCount context behave differently for Forex/Index/Metals?,stratified joins,"resolved_market_group, bucket, wave role",Group-specific distributions,descriptive first,No global score comparison without normalization,Group-specific study phase if needed,Use as caution label.
h1_h4_aux,Does H1/H4 auxiliary improve or add noise?,H1/H4 auxiliary context + ENBOLSA H1/H4 trades,"source_scope, aux bucket, outcome",Outcome vs no aux context,descriptive + sample checks,No replacing H4/D1 base,Only as zoom/support if stable,Keep auxiliary.
